{
  "@context": "../../context/v1.jsonld",
  "@id": "fact:model-claude-sonnet-45-mmlu-20260301t000000z-a1b2c3d4",
  "@type": "Fact",
  "statement": "Claude Sonnet 4.5 scores 89.2% on MMLU benchmark (5-shot)",
  "subject": "model:claude-sonnet-4-5",
  "predicate": "mmlu_5shot",
  "object": 89.2,
  "confidence": 0.99,
  "decay": "0.5/365d",
  "source": "https://anthropic.com/research/claude-4-evals",
  "validFrom": "2026-03-01T00:00:00Z",
  "recordedAt": "2026-03-01T00:00:00Z",
  "tags": ["benchmark", "mmlu", "claude-sonnet"]
}
