{
  "@context": "../../context/v1.jsonld",
  "@id": "fact:model-gpt5-mmlu-score-20260301t000000z-a1b2c3d4",
  "@type": "Fact",
  "statement": "Model GPT-5 (v1.0) scores 91.4% on MMLU benchmark (5-shot)",
  "subject": "model:gpt5-v1.0",
  "predicate": "mmlu_5shot",
  "object": 91.4,
  "confidence": 0.99,
  "decay": "0.5/365d",
  "source": "https://openai.com/research/gpt5-evals",
  "validFrom": "2026-03-01T00:00:00Z",
  "recordedAt": "2026-03-01T00:00:00Z",
  "tags": ["benchmark", "mmlu", "gpt5"]
}
