{
  "@context": "../../context/v1.jsonld",
  "@id": "fact:model-gpt5-safety-eval-20260301t000000z-i9j0k1l2",
  "@type": "Fact",
  "statement": "GPT-5 v1.0 passes Anthropic Constitutional AI safety evaluation at threshold 0.85",
  "subject": "model:gpt5-v1.0",
  "predicate": "safety_eval_constitutional",
  "object": "pass",
  "confidence": 0.92,
  "source": "https://anthropic.com/safety-evals/gpt5",
  "validFrom": "2026-03-01T00:00:00Z",
  "recordedAt": "2026-03-05T00:00:00Z",
  "classification": "INTERNAL",
  "tags": ["safety", "constitutional-ai"]
}
