{
  "@context": "../../context/v1.jsonld",
  "@id": "fact:hash-d41d8cd9-malware-20260423t080000z-i9j0k1l2",
  "@type": "Fact",
  "statement": "SHA256 d41d8cd98f00b204e9800998ecf8427e is a known loader for Emotet",
  "subject": "hash:d41d8cd98f00b204e9800998ecf8427e",
  "predicate": "malware_family",
  "object": "Emotet",
  "confidence": 0.98,
  "source": "https://malware.example.com/reports/emotet-2026-04",
  "validFrom": "2026-04-23T08:00:00Z",
  "recordedAt": "2026-04-23T08:00:00Z"
}
